{
  "schema_version": 1,
  "bundle_id": "20261017T161305Z-export-spike-a4654cb2",
  "joint_model_version": "spike-0",
  "minimum_app_version": "0.1.0",
  "minimum_decoder_version": "0.1.0",
  "created_at_utc": "2026-10-17T16:13:05.832507+00:00",
  "code_revision": "d87b55f6dea6296e9827a88fde2c853ea7fe59c2",
  "dataset_manifest_sha256": null,
  "split_sha256": null,
  "assets": {
    "stage_one": {
      "filename": "yolo26n-seg-food_executorch_model/model.pte",
      "sha256": "ff74b408722123fc2dca1863f13568131e9038de516b0dbf7010b395f9436bb6",
      "bytes": 11005568
    },
    "stage_two": {
      "filename": "efficientnet-b0-seven.pte",
      "sha256": "e7f13160e51262f679d91085ae9dc021a04d4c4de81ec9ca2cf4e912fe17671b",
      "bytes": 16060188
    }
  },
  "environment": {
    "python": "3.12.3",
    "torch": "2.14.0+cu126",
    "timm": "1.0.29",
    "ultralytics": "8.4.154",
    "executorch": "1.5.1",
    "precision": "float32",
    "stage_one_exporter": "Ultralytics ExecuTorch static batch 1 CPU",
    "stage_two_delegate": "XNNPACK static batch 1",
    "target_abis": [
      "arm64-v8a"
    ]
  },
  "pixels": {
    "exif_orientation": "apply once before geometry, orientations 1-8",
    "color": "RGB uint8",
    "alpha": "convert to RGB",
    "grayscale": "convert to RGB",
    "metadata": "discard after decoding"
  },
  "stage_one": {
    "input_shape": [
      1,
      3,
      640,
      640
    ],
    "input_layout": "NCHW",
    "input_dtype": "float32 contiguous",
    "channel_order": "RGB",
    "scale": "uint8 / 255",
    "letterbox": {
      "resize": "OpenCV INTER_LINEAR",
      "fill_rgb": [
        114,
        114,
        114
      ],
      "scale": "min(640 / width, 640 / height)",
      "resized_size": "round(original_size * scale)",
      "left_top_pad": "round((640 - resized_size) / 2 - 0.1)",
      "inverse": "subtract pad, divide by scale, clip to original bounds"
    },
    "raw_outputs": [
      {
        "index": 0,
        "shape": [
          1,
          37,
          8400
        ],
        "dtype": "float32",
        "axes": [
          "batch",
          "4 xywh + 1 class + 32 mask coefficients",
          "anchors"
        ]
      },
      {
        "index": 1,
        "shape": [
          1,
          32,
          160,
          160
        ],
        "dtype": "float32",
        "axes": [
          "batch",
          "mask channels",
          "height",
          "width"
        ]
      }
    ],
    "decode": {
      "head": "one-to-many, no embedded NMS",
      "box_encoding": "center xywh pixels in letterboxed input",
      "class_score": "probability already in [0,1]",
      "score_threshold": 0.25,
      "score_comparison": ">",
      "nms": "class agnostic box IoU, score descending then anchor ascending",
      "nms_iou_threshold": 0.7,
      "max_detections": 300,
      "mask": "coefficients @ prototypes, bilinear upsample to the 640x640 input, >0, then crop to the box at input resolution",
      "mask_iou_dedupe": 0.8,
      "containment_threshold": 0.9,
      "containment_box_iou_guard": 0.5
    }
  },
  "stage_two": {
    "input_shape": [
      1,
      3,
      224,
      224
    ],
    "input_dtype": "float32 contiguous",
    "crop_rule": "provisional: original-image box plus 20% margin, clipped to image bounds",
    "padding": "center pad to square with RGB 128",
    "resize": "OpenCV INTER_LINEAR to 224 x 224",
    "mean": [
      0.5,
      0.5,
      0.5
    ],
    "std": [
      0.5,
      0.5,
      0.5
    ],
    "output_shape": [
      1,
      7
    ],
    "score_path": "linear head logits then temperature softmax"
  },
  "classes": [
    {
      "index": 0,
      "source_id": "6",
      "name_id": "ayam geprek"
    },
    {
      "index": 1,
      "source_id": "5",
      "name_id": "ayam goreng"
    },
    {
      "index": 2,
      "source_id": "39",
      "name_id": "rendang"
    },
    {
      "index": 3,
      "source_id": "B1",
      "name_id": "beef burger"
    },
    {
      "index": 4,
      "source_id": "11",
      "name_id": "mie goreng"
    },
    {
      "index": 5,
      "source_id": "1",
      "name_id": "nasi putih"
    },
    {
      "index": 6,
      "source_id": "reserved",
      "name_id": "bukan_makanan"
    }
  ],
  "thresholds": {
    "temperature": null,
    "dish_acceptance": null,
    "not_food": null
  }
}
